{
  "id": "a16z:fidocure",
  "a16z_company_id": "370817",
  "name": "Fidocure",
  "slug": "fidocure",
  "description": "Precision medicine for dogs and humans who love them",
  "website": "https://www.fidocure.com/",
  "status": "active",
  "sectors": [
    "bio-health",
    "clf"
  ],
  "stages": [
    "seed",
    "venture"
  ],
  "source_urls": {
    "investment_list": "https://a16z.com/investment-list/",
    "portfolio": "https://a16z.com/portfolio/"
  },
  "source_evidence": {
    "in_investment_list": true,
    "in_portfolio": true
  },
  "first_seen_iso": "2026-03-04T06:35:02Z",
  "last_seen_iso": "2026-03-04T06:35:02Z"
}
