{
  "id": "a16z:standard-nuclear",
  "a16z_company_id": "378842",
  "name": "Standard Nuclear",
  "slug": "standard-nuclear",
  "description": null,
  "website": "https://standardnuclear.com",
  "status": "active",
  "sectors": [
    "american-dynamism"
  ],
  "stages": [],
  "source_urls": {
    "investment_list": "https://a16z.com/investment-list/",
    "portfolio": "https://a16z.com/portfolio/"
  },
  "source_evidence": {
    "in_investment_list": true,
    "in_portfolio": true
  },
  "first_seen_iso": "2026-03-04T06:35:02Z",
  "last_seen_iso": "2026-03-04T06:35:02Z"
}
