{
  "id": "a16z:the-promenade",
  "a16z_company_id": null,
  "name": "The Promenade",
  "slug": "the-promenade",
  "description": null,
  "website": null,
  "status": "unknown",
  "sectors": [],
  "stages": [],
  "source_urls": {
    "investment_list": "https://a16z.com/investment-list/",
    "portfolio": null
  },
  "source_evidence": {
    "in_investment_list": true,
    "in_portfolio": false
  },
  "first_seen_iso": "2026-03-04T06:35:02Z",
  "last_seen_iso": "2026-03-04T06:35:02Z"
}
