{
  "id": "a16z:legend-labs",
  "a16z_company_id": "375435",
  "name": "Legend Labs",
  "slug": "legend-labs",
  "description": "Legend is an all-in-one app that offers the best of decentralized finance (DeFi) in one easy-to-use platform.",
  "website": "https://legend.xyz/",
  "status": "active",
  "sectors": [
    "crypto"
  ],
  "stages": [],
  "source_urls": {
    "investment_list": "https://a16z.com/investment-list/",
    "portfolio": "https://a16z.com/portfolio/"
  },
  "source_evidence": {
    "in_investment_list": true,
    "in_portfolio": true
  },
  "first_seen_iso": "2026-03-06T06:34:46Z",
  "last_seen_iso": "2026-03-06T06:34:46Z"
}
