{
  "id": "a16z:fusion-i-o",
  "a16z_company_id": "371743",
  "name": "Fusion I/O",
  "slug": "fusion-i-o",
  "description": "Flash storage that acts like a SAN; circumvents the need to build out massive parallel storage.",
  "website": "http://www.fusionio.com/",
  "status": "exited",
  "sectors": [
    "enterprise"
  ],
  "stages": [
    "growth"
  ],
  "source_urls": {
    "investment_list": "https://a16z.com/investment-list/",
    "portfolio": "https://a16z.com/portfolio/"
  },
  "source_evidence": {
    "in_investment_list": true,
    "in_portfolio": true
  },
  "first_seen_iso": "2026-03-06T06:34:46Z",
  "last_seen_iso": "2026-03-06T06:34:46Z"
}
