{
  "id": "a16z:adaptive",
  "a16z_company_id": "29234",
  "name": "Adaptive",
  "slug": "adaptive",
  "description": "Adaptive is an automated financial management platform for the construction industry. It combines artificial intelligence with simple software to help construction companies automate their job costing and control their cash flow.",
  "website": "https://adaptive.build",
  "status": "active",
  "sectors": [
    "fintech",
    "seed"
  ],
  "stages": [
    "seed"
  ],
  "source_urls": {
    "investment_list": "https://a16z.com/investment-list/",
    "portfolio": "https://a16z.com/portfolio/"
  },
  "source_evidence": {
    "in_investment_list": true,
    "in_portfolio": true
  },
  "first_seen_iso": "2026-03-06T06:34:46Z",
  "last_seen_iso": "2026-03-06T06:34:46Z"
}
