{
  "id": "a16z:robinhood",
  "a16z_company_id": "15431",
  "name": "Robinhood",
  "slug": "robinhood",
  "description": "Robinhood offers commission-free investing and tools to help shape your financial future.",
  "website": "https://robinhood.com",
  "status": "exited",
  "sectors": [
    "fintech",
    "growth"
  ],
  "stages": [
    "growth"
  ],
  "source_urls": {
    "investment_list": "https://a16z.com/investment-list/",
    "portfolio": "https://a16z.com/portfolio/"
  },
  "source_evidence": {
    "in_investment_list": true,
    "in_portfolio": true
  },
  "first_seen_iso": "2026-03-04T06:35:02Z",
  "last_seen_iso": "2026-03-04T06:35:02Z"
}
