{
  "id": "a16z:imply",
  "a16z_company_id": "370849",
  "name": "Imply",
  "slug": "imply",
  "description": "Built from Apache Druid, Imply helps developers become the new heroes of analytics by delivering interactive data experiences on real-time and historical data, with limitless scale and at the best economics.",
  "website": "https://imply.io/",
  "status": "active",
  "sectors": [
    "enterprise",
    "growth",
    "infra"
  ],
  "stages": [
    "venture",
    "growth"
  ],
  "source_urls": {
    "investment_list": "https://a16z.com/investment-list/",
    "portfolio": "https://a16z.com/portfolio/"
  },
  "source_evidence": {
    "in_investment_list": true,
    "in_portfolio": true
  },
  "first_seen_iso": "2026-03-05T06:38:06Z",
  "last_seen_iso": "2026-03-05T06:38:06Z"
}
