{
  "id": "a16z:valora",
  "a16z_company_id": "371306",
  "name": "Valora",
  "slug": "valora",
  "description": "Valora is a mobile-first crypto wallet native to the Celo Platform, available on both iOS and Android devices. Valora makes blockchain useful and accessible even on the most basic smartphones, enabling 6 billion smartphone users worldwide to reliably save, send, and spend crypto as easily as sending a text message.",
  "website": "https://valoraapp.com",
  "status": "active",
  "sectors": [
    "clf",
    "crypto"
  ],
  "stages": [
    "venture"
  ],
  "source_urls": {
    "investment_list": "https://a16z.com/investment-list/",
    "portfolio": "https://a16z.com/portfolio/"
  },
  "source_evidence": {
    "in_investment_list": true,
    "in_portfolio": true
  },
  "first_seen_iso": "2026-03-06T06:34:46Z",
  "last_seen_iso": "2026-03-06T06:34:46Z"
}
