{
  "id": "a16z:arc",
  "a16z_company_id": "15805",
  "name": "Arc",
  "slug": "arc",
  "description": "Arc is developing the next generation of watercraft, starting with electric sport boats. Founded in 2021 in Los Angeles, CA, we're pushing the industry forward on an ambitious timeline.",
  "website": "https://arcboats.com/",
  "status": "active",
  "sectors": [
    "consumer",
    "seed"
  ],
  "stages": [
    "seed",
    "venture"
  ],
  "source_urls": {
    "investment_list": "https://a16z.com/investment-list/",
    "portfolio": "https://a16z.com/portfolio/"
  },
  "source_evidence": {
    "in_investment_list": true,
    "in_portfolio": true
  },
  "first_seen_iso": "2026-03-06T06:34:46Z",
  "last_seen_iso": "2026-03-06T06:34:46Z"
}
