{
  "id": "a16z:wizzywig",
  "a16z_company_id": null,
  "name": "WizzyWig",
  "slug": "wizzywig",
  "description": null,
  "website": null,
  "status": "unknown",
  "sectors": [],
  "stages": [],
  "source_urls": {
    "investment_list": "https://a16z.com/investment-list/",
    "portfolio": null
  },
  "source_evidence": {
    "in_investment_list": true,
    "in_portfolio": false
  },
  "first_seen_iso": "2026-03-03T06:37:51Z",
  "last_seen_iso": "2026-03-03T06:37:51Z"
}
