{
  "id": "a16z:trucksmarter",
  "a16z_company_id": "371001",
  "name": "TruckSmarter",
  "slug": "trucksmarter",
  "description": null,
  "website": "https://www.trucksmarter.com/",
  "status": "active",
  "sectors": [
    "american-dynamism"
  ],
  "stages": [
    "seed",
    "venture"
  ],
  "source_urls": {
    "investment_list": "https://a16z.com/investment-list/",
    "portfolio": "https://a16z.com/portfolio/"
  },
  "source_evidence": {
    "in_investment_list": true,
    "in_portfolio": true
  },
  "first_seen_iso": "2026-03-04T06:35:02Z",
  "last_seen_iso": "2026-03-04T06:35:02Z"
}
