{
  "id": "a16z:resourcely",
  "a16z_company_id": "371240",
  "name": "Resourcely",
  "slug": "resourcely",
  "description": "Resourcely helps developers easily provision and manage cloud infrastructure in a way that is safe, secure, and meets all of your company's policies.",
  "website": "https://resourcely.io",
  "status": "active",
  "sectors": [
    "enterprise",
    "seed",
    "infra"
  ],
  "stages": [
    "seed"
  ],
  "source_urls": {
    "investment_list": "https://a16z.com/investment-list/",
    "portfolio": "https://a16z.com/portfolio/"
  },
  "source_evidence": {
    "in_investment_list": true,
    "in_portfolio": true
  },
  "first_seen_iso": "2026-03-03T06:37:51Z",
  "last_seen_iso": "2026-03-03T06:37:51Z"
}
