{
  "id": "a16z:ng-cashnitra",
  "a16z_company_id": null,
  "name": "NG.CashNitra",
  "slug": "ng-cashnitra",
  "description": null,
  "website": null,
  "status": "unknown",
  "sectors": [],
  "stages": [],
  "source_urls": {
    "investment_list": "https://a16z.com/investment-list/",
    "portfolio": null
  },
  "source_evidence": {
    "in_investment_list": true,
    "in_portfolio": false
  },
  "first_seen_iso": "2026-03-05T06:38:06Z",
  "last_seen_iso": "2026-03-05T06:38:06Z"
}
